{
  "sourceBranch": "claude-mac/issue-1-content",
  "sourceCommit": "b5c7f45",
  "manifests": [
    "docs/salvage/fr-lessons-01-07.md",
    "docs/salvage/fr-lessons-08-14.md",
    "docs/salvage/ta-lessons-01-07.md",
    "docs/salvage/ta-lessons-08-14.md"
  ],
  "entries": [
    { "id": "fr8-je-mappelle", "lane": "#8", "language": "fr", "kind": "construction", "sourceCommit": "b5c7f45", "sourceFile": "src/lib/content/fr/lesson-01.ts", "sourceLesson": "fr-01", "targetLesson": "l2", "targetConstruction": "fr.je-mappelle", "licenseAtSource": "CC-BY-4.0", "status": "planned" },
    { "id": "fr8-salut-vs-bonjour-note", "lane": "#8", "language": "fr", "kind": "note", "sourceCommit": "b5c7f45", "sourceFile": "src/lib/content/fr/lesson-01.ts", "sourceLesson": "fr-01", "targetLesson": "l1", "targetConstruction": "fr.bonjour-politesse", "licenseAtSource": "CC-BY-4.0", "status": "planned" },
    { "id": "fr8-ca-va-et-toi", "lane": "#8", "language": "fr", "kind": "construction", "sourceCommit": "b5c7f45", "sourceFile": "src/lib/content/fr/lesson-01.ts", "sourceLesson": "fr-01", "targetLesson": "l13", "targetConstruction": "fr.ca-va", "licenseAtSource": "CC-BY-4.0", "status": "planned" },
    { "id": "fr8-est-ce-que-note", "lane": "#8", "language": "fr", "kind": "note", "sourceCommit": "b5c7f45", "sourceFile": "src/lib/content/fr/lesson-02.ts", "sourceLesson": "fr-02", "targetLesson": "l2", "targetConstruction": "fr.avez-vous", "licenseAtSource": "CC-BY-4.0", "status": "planned" },
    { "id": "fr8-un-une-gender-note", "lane": "#8", "language": "fr", "kind": "note", "sourceCommit": "b5c7f45", "sourceFile": "src/lib/content/fr/lesson-02.ts", "sourceLesson": "fr-02", "targetLesson": "l1", "targetConstruction": "fr.je-voudrais", "licenseAtSource": "CC-BY-4.0", "status": "planned" },
    { "id": "fr8-sur-place-a-emporter", "lane": "#8", "language": "fr", "kind": "line-pair", "sourceCommit": "b5c7f45", "sourceFile": "src/lib/content/fr/lesson-02.ts", "sourceLesson": "fr-02", "targetLesson": "l1", "targetConstruction": null, "licenseAtSource": "CC-BY-4.0", "status": "planned" },
    { "id": "fr8-apostrophe-recall-variants", "lane": "#8", "language": "fr", "kind": "accepted-variant", "sourceCommit": "b5c7f45", "sourceFile": "src/lib/content/fr/lesson-02.ts", "sourceLesson": "fr-02", "targetLesson": "l1", "targetConstruction": "fr.je-voudrais", "licenseAtSource": "CC-BY-4.0", "status": "planned" },
    { "id": "fr8-je-vais-prendre-note", "lane": "#8", "language": "fr", "kind": "note", "sourceCommit": "b5c7f45", "sourceFile": "src/lib/content/fr/lesson-03.ts", "sourceLesson": "fr-03", "targetLesson": "l6", "targetConstruction": "fr.je-prends", "licenseAtSource": "CC-BY-4.0", "status": "planned" },
    { "id": "fr8-cest-combien-dislocation", "lane": "#8", "language": "fr", "kind": "note", "sourceCommit": "b5c7f45", "sourceFile": "src/lib/content/fr/lesson-03.ts", "sourceLesson": "fr-03", "targetLesson": "l3", "targetConstruction": "fr.combien", "licenseAtSource": "CC-BY-4.0", "status": "planned" },
    { "id": "fr8-ca-fait", "lane": "#8", "language": "fr", "kind": "construction", "sourceCommit": "b5c7f45", "sourceFile": "src/lib/content/fr/lesson-03.ts", "sourceLesson": "fr-03", "targetLesson": "l3", "targetConstruction": "fr.ca-fait", "licenseAtSource": "CC-BY-4.0", "status": "planned" },
    { "id": "fr8-payer-par-carte", "lane": "#8", "language": "fr", "kind": "construction", "sourceCommit": "b5c7f45", "sourceFile": "src/lib/content/fr/lesson-03.ts", "sourceLesson": "fr-03", "targetLesson": "l12", "targetConstruction": "fr.payer-par-carte", "licenseAtSource": "CC-BY-4.0", "status": "planned" },
    { "id": "fr8-neuf-euros-liaison-note", "lane": "#8", "language": "fr", "kind": "note", "sourceCommit": "b5c7f45", "sourceFile": "src/lib/content/fr/lesson-03.ts", "sourceLesson": "fr-03", "targetLesson": "l3", "targetConstruction": "fr.ca-fait", "licenseAtSource": "CC-BY-4.0", "status": "planned" },
    { "id": "fr8-vous-desirez-note", "lane": "#8", "language": "fr", "kind": "note", "sourceCommit": "b5c7f45", "sourceFile": "src/lib/content/fr/lesson-03.ts", "sourceLesson": "fr-03", "targetLesson": "l3", "targetConstruction": null, "licenseAtSource": "CC-BY-4.0", "status": "planned" },
    { "id": "fr8-total-comprehension", "lane": "#8", "language": "fr", "kind": "exercise", "sourceCommit": "b5c7f45", "sourceFile": "src/lib/content/fr/lesson-03.ts", "sourceLesson": "fr-03", "targetLesson": "l3", "targetConstruction": "fr.ca-fait", "licenseAtSource": "CC-BY-4.0", "status": "planned" },
    { "id": "fr8-je-cherche", "lane": "#8", "language": "fr", "kind": "construction", "sourceCommit": "b5c7f45", "sourceFile": "src/lib/content/fr/lesson-04.ts", "sourceLesson": "fr-04", "targetLesson": "l4", "targetConstruction": "fr.je-cherche", "licenseAtSource": "CC-BY-4.0", "status": "planned" },
    { "id": "fr8-ou-sont-plural-note", "lane": "#8", "language": "fr", "kind": "note", "sourceCommit": "b5c7f45", "sourceFile": "src/lib/content/fr/lesson-04.ts", "sourceLesson": "fr-04", "targetLesson": "l4", "targetConstruction": "fr.ou-est", "licenseAtSource": "CC-BY-4.0", "status": "planned" },
    { "id": "fr8-a-cote-de", "lane": "#8", "language": "fr", "kind": "construction", "sourceCommit": "b5c7f45", "sourceFile": "src/lib/content/fr/lesson-04.ts", "sourceLesson": "fr-04", "targetLesson": "l4", "targetConstruction": "fr.a-cote-de", "licenseAtSource": "CC-BY-4.0", "status": "planned" },
    { "id": "fr8-gauche-pronunciation-note", "lane": "#8", "language": "fr", "kind": "note", "sourceCommit": "b5c7f45", "sourceFile": "src/lib/content/fr/lesson-04.ts", "sourceLesson": "fr-04", "targetLesson": "l4", "targetConstruction": "fr.a-gauche-droite", "licenseAtSource": "CC-BY-4.0", "status": "planned" },
    { "id": "fr8-il-y-a-question-exercises", "lane": "#8", "language": "fr", "kind": "exercise", "sourceCommit": "b5c7f45", "sourceFile": "src/lib/content/fr/lesson-04.ts", "sourceLesson": "fr-04", "targetLesson": "l10", "targetConstruction": "fr.il-y-a", "licenseAtSource": "CC-BY-4.0", "status": "planned" },
    { "id": "fr8-a-heure", "lane": "#8", "language": "fr", "kind": "construction", "sourceCommit": "b5c7f45", "sourceFile": "src/lib/content/fr/lesson-06.ts", "sourceLesson": "fr-06", "targetLesson": "l5", "targetConstruction": "fr.a-heure", "licenseAtSource": "CC-BY-4.0", "status": "planned" },
    { "id": "fr8-diner-dejeuner-note", "lane": "#8", "language": "fr", "kind": "note", "sourceCommit": "b5c7f45", "sourceFile": "src/lib/content/fr/lesson-06.ts", "sourceLesson": "fr-06", "targetLesson": "l13", "targetConstruction": null, "licenseAtSource": "CC-BY-4.0", "status": "planned" },
    { "id": "fr8-price-format-note", "lane": "#8", "language": "fr", "kind": "note", "sourceCommit": "b5c7f45", "sourceFile": "src/lib/content/fr/lesson-07.ts", "sourceLesson": "fr-07", "targetLesson": "l3", "targetConstruction": "fr.ca-fait", "licenseAtSource": "CC-BY-4.0", "status": "planned" },
    { "id": "fr8-ellipsis-recall-variants", "lane": "#8", "language": "fr", "kind": "accepted-variant", "sourceCommit": "b5c7f45", "sourceFile": "src/lib/content/fr/lesson-07.ts", "sourceLesson": "fr-07", "targetLesson": "l1", "targetConstruction": "fr.je-voudrais", "licenseAtSource": "CC-BY-4.0", "status": "planned" },
    { "id": "fr8-question-word-completion", "lane": "#8", "language": "fr", "kind": "exercise", "sourceCommit": "b5c7f45", "sourceFile": "src/lib/content/fr/lesson-07.ts", "sourceLesson": "fr-07", "targetLesson": "l4", "targetConstruction": "fr.ou-est", "licenseAtSource": "CC-BY-4.0", "status": "planned" },
    { "id": "fr9-jaime-noun", "lane": "#9", "language": "fr", "kind": "construction", "sourceCommit": "b5c7f45", "sourceFile": "src/lib/content/fr/lesson-08.ts", "sourceLesson": "fr-08", "targetLesson": "l6", "targetConstruction": "fr.jaime-noun", "licenseAtSource": "CC-BY-4.0", "status": "planned" },
    { "id": "fr9-aimer-inf", "lane": "#9", "language": "fr", "kind": "construction", "sourceCommit": "b5c7f45", "sourceFile": "src/lib/content/fr/lesson-08.ts", "sourceLesson": "fr-08", "targetLesson": "l11", "targetConstruction": "fr.aimer-inf", "licenseAtSource": "CC-BY-4.0", "status": "planned" },
    { "id": "fr9-je-naime-pas", "lane": "#9", "language": "fr", "kind": "construction", "sourceCommit": "b5c7f45", "sourceFile": "src/lib/content/fr/lesson-08.ts", "sourceLesson": "fr-08", "targetLesson": "l6", "targetConstruction": "fr.je-naime-pas", "licenseAtSource": "CC-BY-4.0", "status": "planned" },
    { "id": "fr9-adorer-detester", "lane": "#9", "language": "fr", "kind": "construction", "sourceCommit": "b5c7f45", "sourceFile": "src/lib/content/fr/lesson-08.ts", "sourceLesson": "fr-08", "targetLesson": "l6", "targetConstruction": "fr.adorer-detester", "licenseAtSource": "CC-BY-4.0", "status": "planned" },
    { "id": "fr9-moi-aussi-non-plus", "lane": "#9", "language": "fr", "kind": "construction", "sourceCommit": "b5c7f45", "sourceFile": "src/lib/content/fr/lesson-08.ts", "sourceLesson": "fr-08", "targetLesson": "l13", "targetConstruction": "fr.moi-aussi-non-plus", "licenseAtSource": "CC-BY-4.0", "status": "planned" },
    { "id": "fr9-elision-note", "lane": "#9", "language": "fr", "kind": "note", "sourceCommit": "b5c7f45", "sourceFile": "src/lib/content/fr/lesson-08.ts", "sourceLesson": "fr-08", "targetLesson": "l6", "targetConstruction": "fr.jaime-noun", "licenseAtSource": "CC-BY-4.0", "status": "planned" },
    { "id": "fr9-jaime-article-completion", "lane": "#9", "language": "fr", "kind": "exercise", "sourceCommit": "b5c7f45", "sourceFile": "src/lib/content/fr/lesson-08.ts", "sourceLesson": "fr-08", "targetLesson": "l6", "targetConstruction": "fr.jaime-noun", "licenseAtSource": "CC-BY-4.0", "status": "planned" },